{
  "$schema": "./file-operation-matrix.schema.json",
  "schema_version": 1,
  "spatial_analyzer_target": "2026.1.0529.7",
  "objectivesa_commit": "324c73b8e172868b4ccb4a0121e3bd1cbc520c5c",
  "scenarios": [
    {
      "inventory_key": "documentation:FileOperations/Save.htm",
      "mp_step": "Save",
      "scenario": "save",
      "objectivesa_method": "ObjectiveSAClient.Save",
      "fixture_status": "generated_by_test",
      "validation_status": "performed_successfully"
    },
    {
      "inventory_key": "documentation:FileOperations/SaveAs.htm",
      "mp_step": "Save As...",
      "scenario": "save_as",
      "objectivesa_method": "ObjectiveSAClient.SaveAs",
      "fixture_status": "generated_by_test",
      "validation_status": "performed_successfully"
    },
    {
      "inventory_key": "documentation:FileOperations/SaveAsReadOnlyTemplate.htm",
      "mp_step": "Save As Read-Only Template",
      "scenario": "save_as_read_only_template",
      "objectivesa_method": "ObjectiveSAClient.SaveAsReadOnlyTemplate",
      "fixture_status": "generated_by_test",
      "validation_status": "performed_successfully"
    },
    {
      "inventory_key": "sdk:FileOperations_FileExport.txt#1",
      "mp_step": "Export ASCII Points",
      "scenario": "export_ascii_points",
      "objectivesa_method": "ObjectiveSAClient.ExportASCIIPoints",
      "fixture_status": "generated_by_test",
      "validation_status": "performed_successfully"
    },
    {
      "inventory_key": "sdk:FileOperations_FileExport.txt#2",
      "mp_step": "Export ASCII Point Set",
      "scenario": "export_ascii_point_set_wrong_type",
      "objectivesa_method": "ObjectiveSAClient.ExportASCIIPointSet",
      "fixture_status": "generated_wrong_type_by_test",
      "validation_status": "wrong_type_rejected"
    },
    {
      "inventory_key": "sdk:EventOperations.txt#4",
      "mp_step": "Export Event Ref List",
      "scenario": "export_event_ref_list",
      "objectivesa_method": "ObjectiveSAClient.ExportEventRefList",
      "fixture_status": "local_event_reference_list_required",
      "validation_status": "no_valid_fixture"
    },
    {
      "inventory_key": "documentation:FileOperations/XML/ImportNominalsFromXMLFile.htm",
      "mp_step": "Import Nominals from XML File",
      "scenario": "import_nominals_xml",
      "objectivesa_method": "ObjectiveSAClient.ImportNominalsFromXMLFile",
      "fixture_status": "exact_target_xml_fixture_required",
      "validation_status": "not_performed"
    },
    {
      "inventory_key": "documentation:FileOperations/XML/MergeMeasurementsintoXML.htm",
      "mp_step": "Merge Measurements into XML File",
      "scenario": "merge_measurements_xml",
      "objectivesa_method": "ObjectiveSAClient.MergeMeasurementsIntoXMLFile",
      "fixture_status": "exact_target_xml_and_point_group_fixture_required",
      "validation_status": "not_performed"
    },
    {
      "inventory_key": "documentation:ProcessFlowOperations/OutputSAReportToPDF.htm",
      "mp_step": "Output SA Report to PDF",
      "scenario": "output_report_pdf",
      "objectivesa_method": "ObjectiveSAClient.OutputSAReportToPDF",
      "fixture_status": "generated_by_test",
      "validation_status": "performed_successfully"
    },
    {
      "inventory_key": "sdk:FileOperations_FileImport.txt#16",
      "mp_step": "Import VSTARS Cameras",
      "scenario": "import_vstars_cameras",
      "objectivesa_method": "ObjectiveSAClient.ImportVSTARSCameras",
      "fixture_status": "licensed_third_party_fixture_required",
      "validation_status": "not_performed"
    },
    {
      "inventory_key": "sdk:FileOperations_FileImport.txt#19",
      "mp_step": "Import Polyworks File",
      "scenario": "import_polyworks",
      "objectivesa_method": "ObjectiveSAClient.ImportPolyworksFile",
      "fixture_status": "licensed_third_party_fixture_required",
      "validation_status": "not_performed"
    }
  ]
}
